# name: test/sql/integration/attach_mssql.test
# description: A DuckLake catalog in SQL Server: initialize, DDL, inlined data, re-attach (specs/002, 003)
# group: [integration]

# The server-backed suite: `make docker-up` + `make test-integration` provide the connection string
# (docker/docker-compose.yml, .env.example); without it the file skips. CI's floor forbids the skip.
require-env MSSQL_DUCKLAKE_TEST_DSN

# ducklake binds parquet's copy function for every insert, inlined or not; statically linked, but
# the test runner loads static extensions lazily - `require` brings it up
require parquet

statement ok
LOAD '__BUILD_DIRECTORY__/extension/mssql/mssql.duckdb_extension';

statement ok
LOAD '__BUILD_DIRECTORY__/extension/mssql_ducklake/mssql_ducklake.duckdb_extension';

# a side door into the catalog database, for the reset and for looking at what ducklake wrote
statement ok
ATTACH '${MSSQL_DUCKLAKE_TEST_DSN}' AS srv (TYPE mssql);

# a fresh catalog per run: the lake below must be a NEW DuckLake (its data path is this run's test
# directory, and an existing catalog pins the path it was created with). The reset drops every
# ducklake% table in the DSN's database - only in a database the init script marked as the test
# environment (docker/init/sqlserver.sql), never in one the DSN reached by mistake
query I
SELECT count(*) FROM mssql_scan('srv', 'SELECT 1 AS marker FROM sys.tables WHERE name = ''mssql_ducklake_test_env''');
----
1

statement ok
SELECT mssql_exec('srv', '
DECLARE @sql NVARCHAR(MAX) = N'''';
SELECT @sql += N''DROP TABLE '' + QUOTENAME(s.name) + N''.'' + QUOTENAME(t.name) + N'';''
FROM sys.tables t JOIN sys.schemas s ON s.schema_id = t.schema_id
WHERE s.name = ''dbo'' AND t.name LIKE ''ducklake%'';
EXEC sp_executesql @sql;');

# the same predicate the reset used - a catalog someone put in another schema is not ours to drop,
# and counting it here would wedge every later run
query I
SELECT count(*) FROM mssql_scan('srv', 'SELECT t.name FROM sys.tables t JOIN sys.schemas s ON s.schema_id = t.schema_id WHERE s.name = ''dbo'' AND t.name LIKE ''ducklake%''');
----
0

# `ducklake:mssql:<ADO connection string>`: duckdb strips the `mssql:` prefix and picks the mssql
# storage for the catalog ATTACH (the `mssql://` URI form is deliberately not a prefix to duckdb -
# it needs META_TYPE 'mssql' instead). No METADATA_SCHEMA: since mssql v0.2.5 the catalog answers
# `dbo` as its default schema (spec 003)
statement ok
ATTACH 'ducklake:mssql:${MSSQL_DUCKLAKE_TEST_DSN}' AS lake (DATA_PATH '__TEST_DIR__/lake');

# a new DuckLake was initialized in SQL Server, in dbo: the whole catalog schema, its metadata,
# snapshot 0
query I
SELECT count(*) > 20 FROM mssql_scan('srv', 'SELECT t.name FROM sys.tables t JOIN sys.schemas s ON s.schema_id = t.schema_id WHERE s.name = ''dbo'' AND t.name LIKE ''ducklake%''');
----
true

query II
SELECT key, value FROM mssql_scan('srv', 'SELECT [key], [value] FROM dbo.ducklake_metadata WHERE [key] IN (''version'', ''encrypted'')') ORDER BY key;
----
encrypted	false
version	1.0

query I
SELECT snapshot_id FROM ducklake_snapshots('lake');
----
0

# DDL and an inlined insert through the generic manager: the catalog load behind them reads the
# metadata with decorrelated subqueries, which mssql v0.2.5 materializes on the transaction's
# pinned connection (spec 003); the inlined rows land in a ducklake_inlined_data_* table in dbo
statement ok
CREATE TABLE lake.t(i INTEGER, s VARCHAR);

statement ok
INSERT INTO lake.t VALUES (1, 'a'), (2, 'b');

query II
SELECT * FROM lake.t ORDER BY i;
----
1	a
2	b

# the registration row ducklake reads to find that table (<table_id>_<schema_version>)
query I
SELECT table_name FROM mssql_scan('srv', 'SELECT table_name FROM dbo.ducklake_inlined_data_tables');
----
ducklake_inlined_data_1_1

# Every later write to the same table commits too, which is what the Execute passthrough bought
# (specs/004 D1): the batch goes to the server as raw T-SQL through mssql_exec, so duckdb's DML
# path - and its primary-key requirement on ducklake_table_stats - is never involved.
statement ok
INSERT INTO lake.t VALUES (3, 'c');

statement ok
UPDATE lake.t SET s = 'updated' WHERE i = 2;

statement ok
DELETE FROM lake.t WHERE i = 1;

query II
SELECT * FROM lake.t ORDER BY i;
----
2	updated
3	c

# past the inlining limit the rows go to a parquet file, and the catalog records it
statement ok
INSERT INTO lake.t SELECT range, 'row' || range FROM range(10, 40);

query I
SELECT count(*) FROM lake.t;
----
32

query I
SELECT count(*) > 0 FROM mssql_scan('srv', 'SELECT data_file_id FROM dbo.ducklake_data_file');
----
true

statement ok
DETACH lake;

# the second attach finds the existing catalog and loads it (no re-initialization): the table,
# its inlined rows, the snapshots, time travel
statement ok
ATTACH 'ducklake:mssql:${MSSQL_DUCKLAKE_TEST_DSN}' AS lake (DATA_PATH '__TEST_DIR__/lake');

# one snapshot per committed statement: schema, table, and the five writes above
query I
SELECT snapshot_id FROM ducklake_snapshots('lake') ORDER BY 1;
----
0
1
2
3
4
5
6

# and they are physically in dbo, where this attach found them
query I
SELECT count(*) FROM mssql_scan('srv', 'SELECT snapshot_id FROM dbo.ducklake_snapshot');
----
7

query I
SELECT count(*) FROM lake.t;
----
32

# time travel still reads the older snapshots of the same table
query II
SELECT * FROM lake.t AT (VERSION => 2) ORDER BY i;
----
1	a
2	b

query I
SELECT count(*) FROM lake.t AT (VERSION => 1);
----
0

# an existing catalog pins its data path
statement error
ATTACH 'ducklake:mssql:${MSSQL_DUCKLAKE_TEST_DSN}' AS lake2 (DATA_PATH '__TEST_DIR__/elsewhere');
----
<REGEX>:.*does not match existing data path.*

statement ok
DETACH lake;

# TODO(specs/004): the type matrix (research note §5 - FLOAT NaN, TIMESTAMP_NS, HUGEINT, STRUCT, a
# non-ASCII string round trip), our own InitializeDuckLake (keys, filtered indexes, the 2019+ gate,
# the UTF-8 collation), and expire/cleanup.

statement ok
DETACH srv;
